title,year,rated,runtime,genre,director,writer,actors,plot,language,country,awards,imdb_rating,imdb_votes,imdb_id,metascore
Fatal Future,2018,Not Rated,93 min,"Adventure, Comedy, Sci-Fi","Sean Doyle, Michael Keene","Sean Doyle, Michael Keene","Michael Keene, Bri Ana Wagner, Ivy Salazar","The first ever feature-length homage to Vegas-based auteur Neil Breen, this one-of-a-kind, action-packed cyberpunk drama follows the story of MC Dalton, a rogue hacker who's the best at what he does. Dalton finds himself on a deadly journey through the Cyber Grid involving the evil Corporations, bounty hunters, and an AI that might just be his long-dead wife.",English,United States,N/A,5.8,41,tt8589718,N/A
Reunion - Part 1,2018,TV-14,41 min,Reality-TV,N/A,N/A,"Erica Mena Samuels, Rasheeda, Mimi Faust","The cast reunites and the drama becomes too much for one OG cast member. Rasheeda lets Jasmine know what she really thinks about her apology, and Joc &amp; Karlie let slip some steamy details from the dude ranch. Things go left between Spice and Tommie.",N/A,N/A,N/A,N/A,7,tt8589720,N/A
Super Mario Party,2018,N/A,N/A,"Adventure, Comedy, Family",N/A,N/A,"Charles Martinet, Deanna Mustard, Laura Faye Smith, Samantha Kelly","Mario Party is back. The classic series returns for it's eleventh home console installment, bringing back the original board and play style, with new characters and new mini-games joining the fray exclusive to Nintendo Switch.",English,Japan,N/A,N/A,N/A,tt8589722,N/A
Reunion - Part 2,2018,TV-14,41 min,Reality-TV,N/A,N/A,"Erica Mena, Rasheeda, Mimi Faust","Tensions reach a boiling point between Spice and Tommie. Tokyo makes it known she's ready to read anyone who comes for Tabius. Just when BK Brasco thought he was in the clear, his past catches up with him and has Sierra second gue...",English,N/A,N/A,N/A,5,tt8589726,N/A
La Redención,2018,N/A,N/A,History,N/A,Néstor Amarilla Ojeda,"Juan Carlos Notari, Lali Gonzalez, José Barrios, Sergio Cardozo",N/A,Spanish,Paraguay,N/A,7.3,13,tt8589746,N/A
Abandoned,2018,N/A,43 min,Reality-TV,N/A,N/A,"Terry Allen, Angel Alvarenga, Eric Brown, Sawyer Brown","In the search for others, you may find yourself when 12 diverse individuals are dropped alone throughout various islets in Indonesia and challenged to survive among washed-up luggage, ...",N/A,N/A,N/A,7.3,23,tt8589752,N/A
Man Down,2018,N/A,N/A,"Game-Show, Reality-TV",N/A,N/A,N/A,"A chance encounter between Tim and Krichelle takes them by surprise, while Eric finds himself on a solo path. Sawyer, Angel and Richard meet for the first time, but one of them realizes they don't have what it takes to go on. Mean...",N/A,N/A,N/A,N/A,18,tt8589754,N/A
Only the Lonely,2018,N/A,N/A,"Game-Show, Reality-TV",N/A,N/A,N/A,"Tim and Krichelle meet Eric, who has been on a solo journey and feels hesitant to join the pair since asking for help is not in his nature, but his loneliness is getting the best of him. Meanwhile, three other Castaways find thems...",N/A,N/A,N/A,N/A,18,tt8589756,N/A
Three's a Crowd,2018,N/A,N/A,"Game-Show, Reality-TV",N/A,N/A,N/A,"As Matt struggles to make it to other parts of the island with his resources quickly running out, Tim and Krichelle's strong bond starts to take shape, and Sawyer and Richard's similarities make them question if meeting any others...",N/A,N/A,N/A,N/A,19,tt8589758,N/A
A Cry For Help,2018,N/A,N/A,"Game-Show, Reality-TV",N/A,N/A,N/A,"Matt attempts a dangerous swim to another part of the island and stumbles upon two other Castaways, Sawyer and Richard. The thought of splitting resources amongst the trio becomes a stark reality and another obstacle to overcome. ...",N/A,N/A,N/A,N/A,18,tt8589760,N/A
My True Rescue,2018,N/A,N/A,"Game-Show, Reality-TV",N/A,N/A,N/A,"Robbie and Kenzie are convinced Eric is on their island and wonder if he is looking for a companion or would rather be alone. Krichelle struggles with her infection and contemplates leaving the island early, which in turn would le...",N/A,N/A,N/A,N/A,14,tt8589762,N/A
Is It Worth It?,2018,N/A,N/A,"Game-Show, Reality-TV",N/A,N/A,N/A,"The remaining Castaways begin to obsess over the existence of other survivors and whether they are facing similar struggles. Matt decides to search for others across a mile-long channel, risking it all to potentially help his situ...",N/A,N/A,N/A,N/A,12,tt8589764,N/A
Hindsight,2018,N/A,N/A,"Game-Show, Reality-TV",N/A,N/A,N/A,"Terry continues to enjoy the isolation while thriving on the resources left behind by other Castaways who have quit. Matt must decide where he belongs, knowing he'll leave at least one camp questioning his integrity. Tensions reac...",N/A,N/A,N/A,N/A,10,tt8589766,N/A
The Search,2018,N/A,N/A,"Game-Show, Reality-TV",N/A,N/A,N/A,"After a fight divides a camp, starvation forces two Castaways to search for resources that may still exist on the islands. Two Castaways approach their breaking point, unsure of whether or not they can continue.",N/A,N/A,N/A,N/A,11,tt8589768,N/A
We Got This,2018,N/A,N/A,"Game-Show, Reality-TV",N/A,N/A,N/A,"On the season finale, two Castaways come across an abandoned camp full of journals and resources left by other survivors. Deep reflection forces all Castaways to question their ability to stay, forcing yet another to quit. The rem...",N/A,N/A,N/A,8.1,17,tt8589770,N/A
All of My Heart: The Wedding,2018,TV-PG,85 min,Romance,Terry Ingram,Karen Berger,"Lacey Chabert, Brennan Elliott, Pauline Egan","As the big day approaches, Jenny and Brian are faced with having to give up their ownership of Emily's Country Inn to a distant relative, while financial issues continue to plague the couple.",English,United States,1 nomination total,7.1,"1,504",tt8589788,N/A
Un giorno all'improvviso,2018,N/A,88 min,Drama,Ciro D'Emilio,"Cosimo Calamini, Ciro D'Emilio","Anna Foglietta, Giampiero De Concilio, Massimo De Matteo","Antonio dreams of becoming a football star. Miriam, his mother, dreams of rebuilding her family following the abandonment of her husband. When a football scout turns their eye to Antonio, the family dynamic changes.",Italian,Italy,5 wins & 4 nominations,5.7,313,tt8589792,N/A
No Days Off,2017–,N/A,6 min,"Reality-TV, Sport",N/A,N/A,"Robert Barranco, Tamari Davis, Jaylen Huff",Inspirational and engaging stories of emerging athletes in their young ages.,English,United States,N/A,N/A,14,tt8589816,N/A
Finding Fukue,2018,N/A,15 min,"Documentary, Short","Daniel Roher, Edmund Stenson",N/A,Ramin Namdar,A Canadian woman returns to Japan in order to solve the mystery of her long-lost friend.,English,"Canada, Japan",1 win,8.1,54,tt8589820,N/A
Secrets of McDonald's: 50 Years of the Big Mac,2018,N/A,60 min,Documentary,Matthew Nicholson,N/A,"Matthew McNulty, John Banzhaf, Mark Borkowski",The documentary traced the fast food company's journey from Route 66 diner to planet-conquering giant.,English,United Kingdom,N/A,5.8,27,tt8589834,N/A
Lukisan Berlumur Darah,1988,N/A,86 min,Horror,Torro Margens,"Abdullah Harahap, Torro Margens, Imam Tantowi","Tiara Jacquelina, Dharma Harun Al-Rashid, Yurike Prastica","A school teacher and his wife relocate to Indonesia and move into a new home, only to discover the former owner had been killed by burglars and now the place is haunted.",Indonesian,Indonesia,N/A,N/A,165,tt8589846,N/A
Kohtunik,2019,N/A,95 min,"Comedy, Drama, Thriller",Andres Puustusmaa,Andres Puustusmaa,"Märt Avandi, Matti Kröger, Matti Kröger","The Judge (Mait Malmsten) is a man who represents strict rules and laws in the courtroom. However, his own personal life is an absolute mess. After the judge makes a decision to give a long prison sentence to a woman, the woman's brother (Märt Avandi) starts following the judge to change his mind about the verdict. The judge stays adamant. The verdict is final. A conflict takes place between the men, resulting in the judge suddenly becoming a criminal himself. Unable to confess his crime, the judge escapes to Finland, where a series of comedic twists and turns lead him to a number of strange people and comical situations. However, the shadows of his dark deeds keep haunting him. To leave his dark crime behind and to fix his earlier decisions, the judge returns home. ""Your Honor"" is a road movie filled with dark humor, starring Mait Malmsten (""Love Is Blind"", ""Rattrap"") and Märt Avandi (""The Fencer"", ""Red Quicksilver""). The film is directed and written by Andres Puustusmaa (""Green Cats"", ""18-14"", ""Red Quicksilver""). The movie is produced by Leo Production and distributed by ACME Film.","Estonian, Finnish","Estonia, Russia",1 win & 4 nominations,4.5,119,tt8589854,N/A
Episode #2.1,2020,N/A,45 min,"Action, Crime, Drama",Diarmuid Goggins,"Noel Clarke, Ashley Walters, Nick Love","Ashley Walters, Noel Clarke, Olivia Chenery","The crime drama returns. A chance discovery propels Bishop and Pike to go deep undercover to infiltrate a notorious international crime family, the Markides.",English,United Kingdom,N/A,8.3,104,tt8589938,N/A
Episode #2.2,2020,N/A,45 min,"Action, Crime, Drama",Diarmuid Goggins,"Noel Clarke, Ashley Walters, Nick Love","Noel Clarke, Ashley Walters, Olivia Chenery",Tension mounts as Pike and Bishop are drawn deeper into the Markides family. Tanner starts to sweat over her decision to steal drug money to fix a problem in her personal life.,English,United Kingdom,N/A,N/A,93,tt8589940,N/A
Episode #2.3,2020,N/A,45 min,"Action, Crime, Drama",Diarmuid Goggins,"Noel Clarke, Ashley Walters, Nick Love","Ashley Walters, Noel Clarke, Olivia Chenery",Bishop and Pike take the law into their own hands as the hunt for a missing girl leads them to Amsterdam and into the heart of the Markides's dark operations.,English,United Kingdom,N/A,N/A,96,tt8589942,N/A
Episode #2.4,2020,N/A,45 min,"Action, Crime, Drama",Dominic Leclerc,"Noel Clarke, Ashley Walters, Nick Love","Noel Clarke, Ashley Walters, Olivia Chenery","As Alex regains control of the family, Mikey puts Bishop and Pike in charge of a gun-trafficking op. But the boys quickly find themselves out of their depth.",English,United Kingdom,N/A,N/A,87,tt8589944,N/A
Episode #2.5,2020,N/A,45 min,"Action, Crime, Drama",Dominic Leclerc,"Noel Clarke, Ashley Walters, Nick Love","Ashley Walters, Noel Clarke, Olivia Chenery","Elena starts digging into Bishop's identity. Meanwhile, the boys find an unlikely ally as they hunt for a lead in Cyprus. But how long can they keep their cover?",English,United Kingdom,N/A,N/A,82,tt8589946,N/A
Episode #2.6,2020,N/A,45 min,"Action, Crime, Drama",Dominic Leclerc,"Noel Clarke, Ashley Walters, Nick Love","Noel Clarke, Ashley Walters, Olivia Chenery","Bishop and Pike's covers are blown, with serious consequences for the unit. With the boys' lives at stake, Tanner goes head-to-head with Elena.",English,United Kingdom,N/A,N/A,89,tt8589948,N/A
Nielegalni,2018–,N/A,50 min,"Action, Thriller",N/A,N/A,"Grzegorz Damiecki, Agnieszka Grochowska, Sylwia Juszczak","Konrad Wolski, head of the Q department, an elite Polish intelligence unit, taking over a Belarusian arms dealer in Istanbul, learns about a terrorist attack planned in Sweden. The weapon to be used in the attack is to come from the Soviet arsenal hidden in Belarus. Konrad immediately launches Travis, a Polish spy secret in the Minsk KGB, to obtain intelligence information that will frustrate the terrorist plan. The issue is complicated by the fact that Travis has just been exposed by one of the Belarusian KGB officers. Subject to financial blackmail, he will not remain in his position for a long time - the mission of his immediate evacuation goes to Minsk Sara, an officer of the Polish Intelligence Agency. At the same time, a retired general of Belarusian services in Warsaw is blackmailing the Prime Minister of the Republic of Poland. The officers of the Foreign Intelligence Agency must at all costs take over archival materials incriminating the head of the Polish government. All roads lead to Minsk. A murderous game begins with time.","Polish, English, Russian","Poland, Turkey",N/A,6.2,192,tt8589990,N/A
Wagons Ho!,2018,TV-G,42 min,"Game-Show, Reality-TV",N/A,N/A,"Tyler Florence, Lauren Carson, Paris Henry","Tyler Florence kicks off the race at a cattle ranch outside of Los Angeles, where he welcomes the seven teams with their first challenge. The ranch's cowhands need something to wash down their breakfast, so each team must hand-squ...",N/A,N/A,N/A,N/A,8,tt8589992,N/A
Shrimp and Glitz,2018,TV-G,42 min,"Game-Show, Reality-TV",N/A,N/A,"Tyler Florence, Michelle Gautier, Marley Vanderbrook","Tyler Florence welcomes the teams to Las Vegas and gives them a challenge using one of the most popular items on Vegas menus: shrimp. Each truck must create their own ultimate shrimp dish to sell on Fremont Street, and the team th...",N/A,N/A,N/A,N/A,7,tt8589994,N/A
Chapter Forty-Nine: Fire Walk with Me,2019,TV-14,42 min,"Crime, Drama, Mystery",Marisol Adler,"Roberto Aguirre-Sacasa, Aaron Allen, Britta Lundin","K.J. Apa, Lili Reinhart, Camila Mendes","Archie befriends a young runaway, and revisits a piece of his past; Veronica leans into risk at La Bonne Nuit; Jughead works to unite the Serpents.",English,United States,N/A,6.9,1136,tt8589998,N/A
An Oasis in the Desert,2018,TV-G,42 min,"Game-Show, Reality-TV",N/A,N/A,"Tyler Florence, Steven Crowley, Ed Gallagher",The trucks travel to Phoenix and meet Tyler Florence at a Sonic Drive-In for a blind taste test and original savory dish challenge inspired by Sonic's signature drinks. One team member is left operating his truck solo when his tea...,N/A,N/A,N/A,N/A,8,tt8590000,N/A
Bordertown Boom,2018,TV-G,42 min,"Game-Show, Reality-TV",N/A,N/A,"Tyler Florence, Ed Gallagher, Christine Hurley","The trucks roll into the Old West town of Yuma, Ariz., and head to the historic Yuma Territorial Prison, which used to house prisoners from all over the Wild West. Tyler Florence gives the teams a relay challenge involving articho...",N/A,N/A,N/A,N/A,8,tt8590002,N/A
First Dates,2018,TV-G,42 min,"Game-Show, Reality-TV",N/A,N/A,"Tyler Florence, Sharon Shvarzman, Kevin Pettice","The final three teams head to the Coachella Valley in Southern California, where thousands of country music fans will soon arrive for a massive festival. Tyler Florence educates the teams on Medjool dates, which are grown in the a...",N/A,N/A,N/A,N/A,6,tt8590004,N/A
Episode #1.21,2018,N/A,N/A,Reality-TV,"Marty Denholm, Peter Leeson, Hayley MacFarlane",Matt Lovkis,"Erin Barnett, Teddy Briggs, Grant Crapp",N/A,N/A,N/A,N/A,N/A,11,tt8590006,N/A
Chapter Fifty: American Dreams,2019,TV-14,42 min,"Crime, Drama, Mystery",Gabriel Correa,"Roberto Aguirre-Sacasa, Britta Lundin, Brian E. Paterson","K.J. Apa, Lili Reinhart, Camila Mendes",Jughead questions his mom's motives for returning; Archie recruits the gang for a G&amp;G mission.,English,United States,N/A,N/A,1154,tt8590008,N/A
Episode #1.22,2018,N/A,N/A,Reality-TV,"Marty Denholm, Peter Leeson, Hayley MacFarlane",Matt Lovkis,"Erin Barnett, Teddy Briggs, Grant Crapp","Love Island involves a group of contestants, referred to as Islanders, living in isolation from the outside world in a villa in Mallorca, Spain, constantly under video surveillance. To survive in the villa the Islanders must be co...",English,Australia,N/A,N/A,12,tt8590010,N/A
Episode #1.23,2018,N/A,N/A,Reality-TV,"Marty Denholm, Peter Leeson, Hayley MacFarlane",Matt Lovkis,"Erin Barnett, Teddy Briggs, Grant Crapp",N/A,English,Australia,N/A,N/A,12,tt8590012,N/A
Chapter Fifty-One: Big Fun,2019,TV-14,42 min,"Crime, Drama, Mystery",Maggie Kiley,"Roberto Aguirre-Sacasa, Tessa Williams, Britta Lundin","K.J. Apa, Lili Reinhart, Camila Mendes",Rehearsals for the Heathers musical gets underway; Veronica learns some devastating news; Jughead makes a surprising move against Gladys.,English,United States,N/A,4.2,2680,tt8590014,N/A
Episode #1.24,2018,TV-MA,N/A,Reality-TV,"Marty Denholm, Peter Leeson, Hayley MacFarlane",Matt Lovkis,"Erin Barnett, Teddy Briggs, Grant Crapp","Love Island involves a group of contestants, referred to as Islanders, living in isolation from the outside world in a villa in Mallorca, Spain, constantly under video surveillance. To survive in the villa the Islanders must be co...",English,N/A,N/A,N/A,11,tt8590016,N/A
Episode #1.25,2018,N/A,N/A,Reality-TV,"Marty Denholm, Peter Leeson, Hayley MacFarlane",Matt Lovkis,"Erin Barnett, Teddy Briggs, Grant Crapp",N/A,N/A,N/A,N/A,N/A,10,tt8590018,N/A
Chapter Fifty-Two: The Raid,2019,TV-14,42 min,"Crime, Drama, Mystery",Pamela Romanowsky,"Roberto Aguirre-Sacasa, Greg Murray, Ace Hasan","K.J. Apa, Lili Reinhart, Camila Mendes",Betty and Cheryl infiltrate The Farm; Archie reconnects with old friends; Jughead attempts to put a stop to Riverdale's drug trade.,English,United States,N/A,7.1,1056,tt8590024,N/A
Chapter Fifty-Three: Jawbreaker,2019,TV-14,42 min,"Crime, Drama, Mystery",Gabriel Correa,"Roberto Aguirre-Sacasa, Brian E. Paterson, Arabella Anderson","K.J. Apa, Lili Reinhart, Camila Mendes",Betty dives deeper into Edgar's mysterious power; Archie and Veronica team up for a high-stakes fight; Jughead investigates a gruesome murder.,English,United States,N/A,7.2,1090,tt8590026,N/A
Chapter Fifty-Four: Fear the Reaper,2019,TV-14,42 min,"Crime, Drama, Mystery",Alexandra La Roche,"Roberto Aguirre-Sacasa, Janine Salinas Schoenberg, Will Ewing","KJ Apa, Lili Reinhart, Camila Mendes",The Joneses engage in a gripping journey; Archie faces criminal consequences; Betty unpacks a string of shocking revelations about Evelyn.,English,United States,N/A,7.2,1128,tt8590030,N/A
Chapter Fifty-Five: Prom Night,2019,TV-14,41 min,"Crime, Drama, Mystery",David Katzenberg,"Roberto Aguirre-Sacasa, Britta Lundin, Devon Turner","K.J. Apa, Lili Reinhart, Camila Mendes",Mary grows concerned by Archie's boxing desire; Jughead and Betty's plan to confront the Gargoyle King takes an unexpected turn.,English,United States,N/A,N/A,1122,tt8590032,N/A
Chapter Fifty-Six: The Dark Secret of Harvest House,2019,TV-14,42 min,"Crime, Drama, Mystery",Rob Seidenglanz,"Roberto Aguirre-Sacasa, Cristine Chambers, James DeWille","K.J. Apa, Lili Reinhart, Camila Mendes",Veronica stages an elaborate plan; Betty makes a chilling discovery; Jughead finds himself one step closer to unmasking the Gargoyle King.,English,United States,N/A,8.1,1242,tt8590036,N/A
Chapter Fifty-Seven: Survive the Night,2019,TV-14,42 min,"Crime, Drama, Mystery",Rachel Talalay,"Roberto Aguirre-Sacasa, Michael Grassi, Britta Lundin","K.J. Apa, Lili Reinhart, Camila Mendes","After receiving mysterious invitations, the gang band together to confront the evils of their past once and for all; Edgar makes a chilling announcement.",English,United States,N/A,8.1,1535,tt8590040,N/A
Five Days in August,2018,N/A,68 min,Documentary,Nick Ruff,N/A,N/A,"""Five Days in August"" is a feature documentary directed by four-time Emmy® Nominated filmmaker Nick Ruff. The film follows two teams competing in the 44th annual White Marlin Open, the world's largest and richest billfish tournament. With a total of 353 boats battling for an unprecedented $4.9 million in prize money, the stakes couldn't be higher. For these fisherman, it's all on the line.",English,United States,N/A,7.5,12,tt8590046,N/A
Parallels,2022,TV-14,1 min,"Adventure, Fantasy, Mystery",N/A,N/A,"Thomas Chomel, Omar Mebrouk, Naidra Ayadi","The lives of the four friends Bilal, Romane, Samuel and Victor are completely turned upside down when a mysterious event ensures that they are torn from their world and that each of them finds themselves in a different parallel world. Each of the four do everything possible to understand what exactly happened and look for a way to return to their original homeworld.",French,France,N/A,7.0,"2,437",tt8590080,N/A
ultravoKal,2018,N/A,94 min,"Drama, Western",Christophe Karabache,Christophe Karabache,"Angelo Aybar, Stevens Fay, Claudia Fortunato","While on the run, Erwan, a young defector, meets Celia, a lost soul who joins him in his getaway. They are both trailed by an old man, Institoris, sent by the system to track them down and seize them, dead or alive.",French,"France, Belgium",16 wins & 7 nominations,6.4,11,tt8590114,N/A
Wow Girls,2011–,N/A,N/A,Adult,N/A,N/A,"Abbie, Nancy Ace, Sybil","Gorgeous young girls play with themselves, with their girlfriends or with their boyfriends in glamorous settings.",English,United States,N/A,6.3,22,tt8590126,N/A
Tasteless,2018,Not Rated,57 min,"Documentary, Comedy","Jeff Cerulli, Matt Ritter",N/A,"Ashton Applewhite, Michael Barron, Jordan Carlos",She changed comedy by accident,English,United States,N/A,N/A,11,tt8590136,N/A
Issue #101: How Do You Raise a Superhero?,2019,TV-PG,43 min,"Drama, Sci-Fi",Seith Mann,"Carol Barbee, Dennis Liu, Kimberly Ndombe","Alisha Wainwright, Ja'Siah Young, Jazmyn Simon","Widowed mom Nicole struggles to raise her only child Dion, not knowing the second-grader possesses powers beyond anyone's comprehension.",English,United States,N/A,7.2,625,tt8590174,N/A
The Manager,2020,TV-14,31 min,"Comedy, Drama",Deepa Mehta,"Lee Eisenberg, Emily V. Gordon, Kumail Nanjiani","Suraj Sharma, Ishan Gandhi, Eshan Inamdar","When his parents are deported, 12-year-old Kabir is left to run the family's motel.",N/A,N/A,N/A,7.7,564,tt8590194,N/A
Fire Knows Nothing of Mercy,2018,TV-MA,52 min,"Action, Drama, Mystery",Christoph Schrewe,"Olen Steinhauer, Jill E. Blotevogel, Zach Craley","Richard Armitage, Leland Orser, Keke Palmer","Berlin Station follows up on the evidence Kirsch brought home from his mission, crystallizing their theory about a possible upcoming invasion.",English,"United States, Germany",N/A,N/A,274,tt8590216,N/A
Many Moon's Strife,2020,N/A,N/A,"Drama, Fantasy",Rafiya Williams,"Qutaibah Alkhateeb, Rafiya Williams","Megan Purvis, Joseph Tremain, Lauren Shotton, Harry Wight","Many Moon's Strife is a fantasy drama which tells the story of a young woman who is coping with the loss of her friend to suicide. After discovering a way to go back in time, she resolves ...",English,UK,N/A,N/A,N/A,tt8590218,N/A
Monster Mountain Trains,2018,TV-PG,42 min,"Documentary, History",N/A,N/A,Mike Bratton,"The world's toughest trains have conquered the deadly heights of our tallest mountains, and were made possible by cutting-edge railroads engineered to make impossible climbs and brave extreme weather.",N/A,N/A,N/A,N/A,5,tt8590230,N/A
Stacja bezsennosc,1974,N/A,38 min,"Drama, Sci-Fi",Piotr Wojciechowski,Piotr Wojciechowski,"Hanna Stankówna, Edward Kusztal, Marek Walczewski",N/A,Polish,Poland,N/A,4.6,19,tt8590234,N/A
Pepsi 'Big Slam' Commercial,2001,N/A,N/A,Short,Joe Pytka,N/A,"Ken Griffey Jr., Sammy Sosa",N/A,English,United States,N/A,N/A,N/A,tt8590248,N/A
Every Mayflower Has Its Thorn,2018,TV-14,43 min,Reality-TV,N/A,N/A,"Carole Radziwill, Dorinda Medley, Ramona Singer","Luann is out of rehab and the ladies whisk her away for a spa weekend in Connecticut. The relaxation doesn't last long as Luann discovers that Ramona tried to get an invite to Tom's New Year's Eve party. Meanwhile, Dorinda and Son...",N/A,N/A,N/A,N/A,16,tt8590258,N/A
Babies Behind Bars,2018–,N/A,N/A,Reality-TV,N/A,N/A,N/A,"Imprisoned mothers are given the unique opportunity to raise their babies behind bars. But rules are strict, and one slip-up can take it all away.",English,United Kingdom,N/A,7.2,8,tt8590316,N/A
A Blind Alley,2018,N/A,28 min,"Short, Drama, Romance",Suyeon Oh,N/A,N/A,N/A,Korean,South Korea,N/A,N/A,N/A,tt8590346,N/A
I Catfished My Kid,2017,N/A,18 min,"Short, Reality-TV",Jeffrey A. Fisher,N/A,Elliott Morgan,"Host Elliot Morgan helps two sets of parents uncover just how alarming their daughters' online behavior is, and together they catfish the girls to open their eyes and save their lives.",English,United States,N/A,2.8,20,tt8590390,N/A
Days of Harmony,2016,N/A,N/A,Short,Ryan Little,N/A,N/A,"The film depicts Joseph and Emma Smith's faith despite adversity and persecution, Joseph beginning the translation of the Book of Mormon, the loss of 116 pages of the translation manuscript, Oliver Cowdery's arrival and work as a scribe, and the restoration of the Aaronic and Melchizedek Priesthoods.",English,United States,1 win,7.6,7,tt8590414,N/A
A Day for the Eternities,2016,N/A,N/A,Short,Ryan Little,N/A,N/A,"A Day for the Eternities tells about events surrounding the restoration of the gospel of Jesus Christ that took place in the 1830s at the Peter Whitmer farm in Fayette New York. The film depicts Joseph Smith completing the translation of the Book of Mormon, the experiences of the witnesses of the Book of Mormon, and the organization of the restored Church of Jesus Christ.",English,United States,1 win,N/A,N/A,tt8590434,N/A
NXT Championship,2018,N/A,59 min,"Action, Sport",N/A,N/A,"Shayna Andrea Baszler, Tyler Bate, Bianca Blair","From Full Sail Live at Full Sail University in Winter Park, Florida U.S.A. it's WWE NXT Champion Aleister Black vs. Tommaso Ciampa; WWE NXT North American Champion Adam Cole of The Undisputed ERA vs. Sean Maluta; and more. (#449)",N/A,N/A,N/A,N/A,15,tt8590446,N/A
You'll Only Have Each Other,2018,N/A,17 min,"Short, Drama",Alison-Eve Hammersley,"Alison-Eve Hammersley, Samantha Silvay","Amelia Rose Blaire, Bryan Dechart, Jennifer Toffel","After the death of her mother, a disconnected daughter must face the strange and horrible manifestations of her guilt.",English,United States,4 wins & 17 nominations,6.0,49,tt8590472,N/A
MILF Lessons,2004–,N/A,N/A,Adult,N/A,N/A,"Preston Parker, Alex Gonz, Jarrod Steed",N/A,English,United States,N/A,N/A,N/A,tt8590474,N/A
"Citation Needed, from the Technical Difficulties",2014–2018,N/A,16 min,"Comedy, Game-Show, Talk-Show",N/A,N/A,"Tom Scott, Gary Brannan, Chris Joel","Tom Scott quizzes three of his friends from Yorkshire on a randomly selected article from everybody's favourite reliable source of information, Wikipedia.",English,United Kingdom,N/A,9.3,41,tt8590476,N/A
