title,year,rated,runtime,genre,director,writer,actors,plot,language,country,awards,imdb_rating,imdb_votes,imdb_id,metascore
Volume 3: Chapter VII,2019,TV-MA,33 min,"Comedy, Drama",Tiffany Johnson,"Leann Bowen, Steven J. Kung, Justin Simien","Logan Browning, Brandon P Bell, DeRon Horton","As Chester's popularity soars, Lionel tries to convince D'unte and friends that he's ready for the gay ""deep end."" Sam gets a chance to meet her idol.",English,United States,N/A,N/A,218,tt8598410,N/A
Volume 3: Chapter VIII,2019,N/A,N/A,"Comedy, Drama",Samantha Bailey,"Njeri Brown, Justin Simien, Leann Bowen","Logan Browning, Brandon P Bell, DeRon Horton",N/A,"English, French",United States,N/A,N/A,214,tt8598412,N/A
Volume 3: Chapter IX,2019,TV-MA,25 min,"Comedy, Drama",Salli Richardson-Whitfield,"Njeri Brown, Nastaran Dibai, Justin Simien","Logan Browning, Brandon P Bell, DeRon Horton","Brooke takes a new approach with Muffy, a guilt-stricken Gabe tries to make up for his mistake, and Troy woos an investor for his new magazine.",English,United States,N/A,N/A,213,tt8598414,N/A
Volume 3: Chapter X,2019,N/A,N/A,"Comedy, Drama",Justin Simien,"Justin Simien, Leann Bowen","Logan Browning, Brandon P Bell, DeRon Horton",N/A,English,N/A,N/A,N/A,229,tt8598416,N/A
Jackie the Ripper,2018,N/A,N/A,"Drama, Fantasy, Horror",N/A,Robert Campagna,N/A,"Garvey is up to her ""Secret recipes"" as Calvin tries to balance being a father for the first time in his life. Tilly and Be a realize something they both do not like to admit.",N/A,N/A,N/A,N/A,9,tt8598432,N/A
The Hour of Honor,2018,N/A,225 min,"Adventure, Fantasy",Matthew Mercer,N/A,"Laura Bailey, Taliesin Jaffe, Matthew Mercer","The Mighty Nein explore the town of Hupperdook, and find much more intrigue than they bargained for...",English,United States,N/A,N/A,40,tt8598452,N/A
Insufferable Groo: Journey to England,2018,N/A,112 min,Documentary,Stephen Groo,N/A,"Sherry Groo, Stephen Groo",Stephen Groo a film director heads to England for his first time to view the world premiere of The Insufferable Groo. See through his eyes his journey in England. A documentary of a documentary.,English,United States,N/A,N/A,N/A,tt8598454,N/A
Luigi's Mansion,2018,N/A,N/A,"Adventure, Comedy, Horror",Hideki Konno,N/A,"Toru Asakawa, Samantha Kelly, Charles Martinet, Kazumi Totaka","This enhanced remake of Luigi's Mansion includes new modes, graphical upgrades, and portability, bringing Luigi's first ghost-hunting adventure to a handheld device.",English,Japan,N/A,8.3,15,tt8598482,N/A
WarioWare Gold,2018,N/A,N/A,"Action, Comedy, Family",Goro Abe,Nami Komuro,"Charles Martinet, Alex Cazares, Stephanie Sheh, Vegas J. Jenkins","WarioWare Gold is the first installment of the WarioWare series on Nintendo 3DS. Bringing back multiple mini-games, alongside new ones. This is the ultimate microgame collection.",English,Japan,N/A,8.1,15,tt8598494,N/A
Aleppo,2019,N/A,20 min,"Short, Drama",Anthony Grippa,"Morris Long, Brennan Elizabeth Peters","Laëtitia Eïdo, Walles Hamonde, Amel Khalil, Alexander Saliba","Hanan, a successful Syrian-American doctor, returns to Syria to help victims of war. When the hospital where she works is bombed, she suffers a traumatic brain injury that leaves her face ...",English,N/A,1 win & 3 nominations.,N/A,N/A,tt8598514,N/A
Killer Single Dad,2018,TV-14,86 min,Thriller,Robert Malenfant,"Ken Sanders, Daniel West","Kaitlyn Black, Cameron Jebo, Robert Parks-Valletta","An expectant mother befriends a Good Samaritan who saved her life, but is unaware that he is the father of her unborn baby and is ""collecting"" all of the children he sired as an anonymous sperm donor years before.",English,United States,N/A,5.3,294,tt8598532,N/A
Brindisi,2019,N/A,84 min,"Comedy, Romance","Nika Burnett, Alessandro Marino","Nika Burnett, Alessandro Marino","Abigail Marlowe, Nika Burnett, Alessandro Marino","Three young couples in the south of Italy whose varied lives intersect on a boat to Greece, as they run from their responsibilities, the public eye and the police. In the style of the Academy Award winner of 1964, Ieri, Oggi, Domani, starring the legendary on screen pair of Sofia Loren and Marcello Mastroianni, all three couples will be played by the same actors. This gives the classic farcical commentary of Shakespeare's A Comedy of Errors, and emphasizes the thoughts provoked by the dialogue heavy script -- What does it mean to be 25 years old, to have only the experiences of a child, but the responsibilities of an adult? How do you make decisions for the rest of your life when it hasn't happened yet?","English, French, Italian",United States,3 nominations,N/A,22,tt8598534,N/A
Mafia Ties,2018–,N/A,N/A,Crime,N/A,N/A,"Delaney Hathaway, Chris Ketler, Peter Georgo","#MafiaTies A Organized Crime Drama and Love Story about The Notorious Vercelli Family and 2 child hood best friends 2 kids growing up in The life of Organized Crime, Drugs Wars, Lies, Family secrets and Murder.",English,N/A,N/A,4.6,55,tt8598566,N/A
"Tim, Jim and Kim",2018,TV-Y,11 min,"Animation, Adventure, Comedy","Johnny Darrell, Andrew Duncan",Mark Robert Edwards,"Seán Cullen, Mark Robert Edwards, Katie Griffin","Tensions arise when Tim's jealous brother Jim visits with his flirtatious new fiancée, Kim.",English,"United States, Canada",N/A,N/A,N/A,tt8598578,N/A
Deadly Detour,2018,TV-PG,N/A,"Documentary, News",N/A,N/A,"Lester Holt, Josh Mankiewicz","When a prominent attorney claims to have accidentally shot his wealthy wife, the local prosecutor questions his story.",N/A,N/A,N/A,N/A,20,tt8598652,N/A
False Identity,2018–2021,TV-14,N/A,"Crime, Drama, Romance",N/A,N/A,"Luis Ernesto Franco, Samadhi Zendejas, Eduardo Yáñez","Diego is a hustler and involved in high stakes criminal activity, including tapping into an oil refinery pipeline and stealing gasoline to resell at a vastly decreased cost. Forced to leave the country, his brother, who is a politician, arranges a cover ID so that he can go and live in the United States. Camila, a beautiful mother of two children is in an abusive marriage where she is regularly assaulted by her alcoholic husband. She also wants to escape and vanish with a new identity. Diego, Camila, and her kids are paired up as they cross the border as a family.",Spanish,Mexico,2 nominations,7.0,437,tt8598690,N/A
"Pain, Love and Sacrifice to the Gods",2018,TV-14,44 min,"Action, Drama, Sport","Quinn Saunders, Skip Chaisson",Christopher DeJoseph,"Justin Borden, Brian Cage, Melissa Cervantes","Catrina gives Melissa a gift. Johnny Mundo and Taya take on Kobra Moon and her King, Daga. Antonio gives King Cuerno the chance for revenge and the chance to win an Ancient Aztec Medallion. The Monster Matanza Cueto makes a Sacrifice to the Gods.","English, Spanish",United States,N/A,N/A,19,tt8598694,N/A
Sacrificio,2018,N/A,60 min,"Action, Drama, Sport","Quinn Saunders, Skip Chaisson",Christopher DeJoseph,"Justin Borden, Brian Cage, Matt Capiccioni, Jeffrey Cobb",N/A,"English, Spanish",USA,N/A,8.0,15,tt8598702,N/A
Break the Machine,2018,N/A,60 min,"Action, Drama, Sport","Quinn Saunders, Skip Chaisson",Christopher DeJoseph,"Justin Borden, Brian Cage, Matt Capiccioni, Melissa Cervantes",N/A,"English, Spanish",USA,N/A,8.1,16,tt8598704,N/A
The Gift That Keeps on Giving,2018,N/A,60 min,"Action, Drama, Sport","Quinn Saunders, Skip Chaisson",Christopher DeJoseph,"Melissa Anderson, Matt Capiccioni, Martin Casaus","Paul London battles newcomer Desmond X for the Final Aztec Medallion; Johnny Mundo takes on the Giant Snake Man, Vibora. Jack Evans scouts XO Lishus; Cage does battle with Pentagon Dark.",English,United States,N/A,N/A,16,tt8598708,N/A
The Ranks of the Reptiles,2018,N/A,60 min,"Action, Drama, Sport","Quinn Saunders, Skip Chaisson",Christopher DeJoseph,"Justin Borden, Brian Cage, Matt Capiccioni",N/A,English,United States,N/A,N/A,18,tt8598710,N/A
A Match Made in Heaven,2018,TV-14,45 min,"Action, Drama, Sport","Quinn Saunders, Skip Chaisson",Christopher DeJoseph,"Melissa Anderson, Justin Borden, Melissa Cervantes, Jeffrey Cobb","Mariposa makes a proposal to Antonio Cueto. Paul London makes an offering to the Gods on behalf of the White Rabbit. The Worldwide Underground take on The Reptile Tribe in an Atomicos Match, if the Reptiles win, Johnny must join them.","English, Spanish",USA,N/A,7.9,14,tt8598712,N/A
A Snake Scorned,2018,TV-14,44 min,"Action, Drama, Sport","Quinn Saunders, Skip Chaisson",Christopher DeJoseph,"Justin Borden, Brian Cage, Matt Capiccioni",Paul London attempts to satisfy the White Rabbit. Tensions between the Trios Champions are at an all-time high as they are forced to defend their titles against a dangerous opponent. Cage and Pentagon Dark's conflict explodes.,"English, Spanish",United States,N/A,N/A,17,tt8598714,N/A
She Hulk,2008,N/A,9 min,"Short, Action",Stephen Groo,Stephen Groo,"Stephen Groo, Joseph Hawkins, Aaron Parker",Short based off the first comic of She Hulk by Marvel Comics. Jennifer Walters get shot by henchmen who follow a drug lord named Trask. Bruce Banner also known as the Incredible Hulk who is her cousin saves her life by giving his blood to her. She transforms into the She Hulk and starts a whole new life.,English,United States,N/A,N/A,322,tt8598758,N/A
Wowzers,2019,TV-MA,40 min,"Short, Drama, Fantasy",Ace Thor,"Sam Fox, Ace Thor","Sam Fox, Sam Ball, Sarah Jo Marson",A tormented young woman haunted by a recurring dream is catapulted into a peculiar and deviant world where she is confronted by the duality of her existence.,English,United States,3 wins,6.0,36,tt8598760,N/A
The Artifact,2008,N/A,59 min,Horror,Stephen Groo,N/A,"Stephen Groo, Sarah Hawkins, Denise Metcalf","A group of friends come together for their annual Halloween get together, but an artifact sent from Patrick's grandfather changes it from a pleasant event to a horrific one.",English,United States,N/A,2.1,11,tt8598776,N/A
Catching Up,2019,N/A,107 min,"Comedy, Drama, Romance",Bill Crossland,"Mindy Beach, Bill Crossland, Patrick Morris","Bill Crossland, Francesca Carpanini, Isabella Pisacane",A romantically inexperienced man with muscular dystrophy struggles to win the love of his able-bodied crush while posing as a boyfriend for his closeted best friend.,English,United States,2 nominations total,6.8,100,tt8598802,N/A
Ram Raid Britain,2015,TV-14,43 min,"Documentary, Crime",N/A,N/A,"Nick Wallis, Viv Brownley, John Dexter","A smash-and-grab jewelry store robbery, a daring cash machine heist and a frightening attack in a pub are part of a new breed of ram-raid thefts.",English,United Kingdom,N/A,7.2,8,tt8598870,N/A
Bubble Gum,2018,N/A,9 min,"Short, Drama",Ella Fields,Ella Fields,"Eleanor Bastable, Jordan Alexa Davis","After meeting Blossom, Indigo falls completely head over heels. There is only one problem, though. She's straight.",English,United States,4 wins,8.4,21,tt8598878,N/A
Gator vs. Python,2018,TV-PG,40 min,Reality-TV,N/A,N/A,"Zak Catchem, Dusty Crum, Troy Landry","As Troy lends a hand in the battle against giant invasive Burmese pythons, he's thrust into a war between the Everglades' most dangerous beasts.",N/A,N/A,N/A,N/A,5,tt8598880,N/A
Hogzilla,2018,TV-PG,39 min,Reality-TV,N/A,N/A,"Ashley, Phylis Canion, Troy Landry",Troy searches for a monster threatening residents of a small Texas community.,N/A,N/A,N/A,N/A,5,tt8598886,N/A
101,2018,N/A,N/A,Reality-TV,N/A,N/A,"Jordan C. Arrant, Havilah Malone, Jesse Palmer","Ten eligible gentlemen, including a man in search of his unicorn and another seeking his ""precious,"" vie for the heart of Ashlee, a mystery woman whose love story begins with two heartfelt proposals and one life-changing decision.",N/A,N/A,N/A,N/A,46,tt8598902,N/A
Snowblind,2018,N/A,42 min,"Short, Horror, Western",Brady McAtee,"Colton Cummins, Brady McAtee","Brian Boyd, Corinne Charbonneau, Colton Cummins, Stan Smith",A young man learns the hardships of growing up fast when his ill father can no longer care for him in the ever so depleting forest they used to rely on.,English,USA,N/A,N/A,N/A,tt8598918,N/A
Milk Aisle,2018,N/A,N/A,"Short, History",Jordan Hunt Young,Jordan Hunt Young,"Robert Babcock, Baylie Brown, Barry Clifton","""Milk Aisle"" is set in the late 1950's and shares the story of a young black man who is imprisoned for a crime he didn't commit. While in prison, he accidentally receives a letter from a young white girl who thought her letter was going to a vacuum cleaner company but it mistakenly got attached to a letter going to the prison. On a whim, the young black man responds and an unlikely relationship begins. Completely unaware of who exactly they are corresponding with, they both live in bliss - until the letters are discovered and their true identities are made known.",English,United States,1 win,N/A,6,tt8598954,N/A
Dooley's Not Dooby,2018,N/A,4 min,"Short, Music",Scott Allen Nollen,Scott Allen Nollen,"Louis Armstrong, Louise Beavers, Willie Best, Humphrey Bogart","Scott Allen Nollen, incensed at someone's reference to Dooley Wilson as ""Dooby,"" composed this tribute to the African American performers of Hollywood's ""Golden Age"" for his band Jimmie Dynamite.",English,USA,N/A,8.9,12,tt8598960,N/A
Our Error World,2018,N/A,24 min,"Animation, Action, Drama, Romance, Sci-Fi",N/A,N/A,Shimba Tsuchiya,"Super intelligent AI have spurred society to change. As the fight surrounding Arato and Lacia escalates, the leaders of the old guard discuss how they could maximize their own profits. ...",N/A,N/A,N/A,N/A,N/A,tt8599000,N/A
Episode #2.1,2019,N/A,N/A,"Comedy, Drama",Ulli Baumann,N/A,"Bert Tischendorf, Andreja Schneider",N/A,German,Germany,N/A,N/A,N/A,tt8599036,N/A
Gaffer,2019,N/A,46 min,"Comedy, Drama",Ulli Baumann,"Dominik Moser, Thomas Vass","Bert Tischendorf, Deborah Schneidermann, Louis Christiansen",Gaffer.,German,Germany,N/A,N/A,9,tt8599062,N/A
Tod den Tyrannen,2019,N/A,46 min,"Comedy, Drama",Ulli Baumann,"Polina Horosina, Thomas Vass, Thomas Rogel","Bert Tischendorf, Deborah Schneidermann, Louis Christiansen",N/A,German,Germany,N/A,N/A,7,tt8599070,N/A
Drogendealer,2019,N/A,44 min,"Comedy, Drama",Ulli Baumann,"Janosch Kosack, Thomas Vass","Bert Tischendorf, Louis Christiansen, Jolina Uhrig",N/A,German,N/A,N/A,N/A,8,tt8599086,N/A
Ailleurs ou autre part,2018,N/A,49 min,"Crime, Drama, Mystery",Frédéric Schoendoerffer,"Jean-Yves Arnaud, Yoann Legave","Marc Lavoine, Sofia Essaïdi, Isabelle Renauld","Samuel Kepler suffers from a personality disorder: several passengers live side-by-side in his head. After one caused a police operation to end in tragedy he is given a desk job in Calais. But when a young girl disappears, he returns to the field partnered by Alice Haddad, a local policewoman.",French,France,N/A,N/A,12,tt8599094,N/A
A l'âme en secret,2018,N/A,49 min,"Crime, Drama, Mystery",Frédéric Schoendoerffer,"Jean-Yves Arnaud, Yoann Legave","Marc Lavoine, Sofia Essaïdi, Isabelle Renauld",N/A,"French, English",France,N/A,N/A,11,tt8599104,N/A
L'embrasement,2019,N/A,50 min,"Crime, Drama, Mystery, Thriller",Frédéric Schoendoerffer,"Jean-Yves Arnaud (creator), Yoann Legave (creator), Jean-Yves Arnaud, Yoann Legave","Marc Lavoine, Sofia Essaïdi, Isabelle Renauld, Élodie Navarre",N/A,French,France,N/A,6.2,9,tt8599106,N/A
Sous le projecteur,2019,N/A,48 min,"Crime, Drama, Mystery",Frédéric Schoendoerffer,"Jean-Yves Arnaud, Yoann Legave","Marc Lavoine, Sofia Essaïdi, Isabelle Renauld",N/A,French,France,N/A,N/A,9,tt8599108,N/A
Fiela se Kind,2019,N/A,120 min,Drama,Brett Michael Innes,"Brett Michael Innes, Dalene Matthee","Zenobia Kloppers, Luca Bornman, Wayne Smith","A coloured woman living in the arid Karoo takes in a lost white child and raises him as her own. Nine years later, the boy is removed and forced to live in the Knysna Forest with a family of woodcutters who claim that he is theirs.",Afrikaans,South Africa,7 wins & 29 nominations,6.7,107,tt8599112,N/A
Au bord de l'abîme,2019,N/A,49 min,"Crime, Drama, Mystery",Frédéric Schoendoerffer,"Jean-Yves Arnaud, Yoann Legave","Marc Lavoine, Sofia Essaïdi, Isabelle Renauld",N/A,French,France,N/A,N/A,9,tt8599118,N/A
Au pays qui te ressemble,2019,N/A,51 min,"Crime, Drama, Mystery, Thriller",Frédéric Schoendoerffer,"Jean-Yves Arnaud (creator), Yoann Legave (creator), Jean-Yves Arnaud, Yoann Legave","Marc Lavoine, Sofia Essaïdi, Isabelle Renauld, Serge Riaboukine",N/A,French,France,N/A,6.4,9,tt8599122,N/A
Managing England: The Impossible Job,2018,N/A,60 min,"Documentary, Sport",Rob Facey,N/A,"Sam Allardyce, Fabio Capello, David Davies","The trials, tribulations and perpetual disappointments which have beset the managers of the England men's national football team since the country's solitary tournament win in 1966.",English,United Kingdom,N/A,7.1,33,tt8599146,N/A
Traverse for hope,2018,N/A,N/A,"Short, Sci-Fi",Gaurav Thakur,Gaurav Thakur,Purva Thakur,Traverse for hope based on outer space exploration. The story is about a young girl from a small town who dreams to be the next kalpana chawla.,English,India,N/A,7.6,8,tt8599220,N/A
Potluck with Smooch,2018–2020,N/A,N/A,Comedy,N/A,N/A,"Diq Diamond, Jeff Juett, Robert D. MacLean, Ted T.E. Tunney",N/A,English,USA,N/A,N/A,N/A,tt8599258,N/A
Episode #3.1,2018,TV-MA,40 min,"Biography, Crime, Drama",Ernesto Contreras,"Silvana Aguirre, Esteban Orozco","Marco de la O, Humberto Busto, Marcela Mar",The DEA is alarmed by the expansive growth of El Chapo's drug empire. Don Sol forges a new alliance to further his career.,N/A,"Mexico, United States",N/A,N/A,304,tt8599264,N/A
Bitti Business Wali,2018–,N/A,N/A,Drama,N/A,N/A,"Arshi Khan, Preeti Kochar, Neha Kaul","Bitti Business Wali is a Hindi drama television series starring Prakruti Mishra, Abhishek Bajaj, Neeraj Sood, Neelima Pandhekar and Manmohan Tiwari. Bitti, a young opinionated girl, defies traditional norms and sets up an unconventional business of Paan Shop to support her family.",N/A,India,N/A,8.6,38,tt8599266,N/A
Norway,2018,N/A,46 min,Documentary,Emma Webster,N/A,"Caroline Quentin, Piers Taylor",N/A,English,N/A,N/A,7.9,90,tt8599270,N/A
Israel,2018,N/A,46 min,Documentary,Will Hustler,N/A,"Caroline Quentin, Piers Taylor",N/A,English,N/A,N/A,7.0,76,tt8599282,N/A
Police Junior,2018,N/A,143 min,"Action, Thriller",Suresh Shankar,"Suresh Pathissery, Suresh Shankar","Shanavas Shanu, Narain, Sunil Sukhada","Police Junior is a Malayalam movie starring Kanakalatha Pilla, Narain Kumar and Shanavas Prem Nazir in prominent roles. It is a drama directed by Suresh Sankar.",Malayalam,India,N/A,N/A,8,tt8599324,N/A
1m2,2019,N/A,N/A,Documentary,Cenk Ogurtani,N/A,N/A,"A photographer, who misses the nature and the creatures which live freely in there, abandons the borders of the chaotic city in the early hours of the morning. Then it reaches an uncharted green area and prepares its equipment for video shooting. Firstly, he starts recording the moving images of honey bees and then a ladybug. The photographer's camera does not stop there and moves from branch to branch, leaf to leaf, insect to insect and tells heart touching short stories from life cycles of many different species of this small-scale world. The instant happiness of this nature lover, who observes the life with pleasure, will not last very long of course and the destructive intervention of man, which exploits the nature, will not be delayed too much again to show his brutal face.",N/A,Turkey,N/A,9.5,10,tt8599416,N/A
Episode #1.8,2018,TV-MA,N/A,"Drama, Music, Romance",Liliana Bocanegra,"Said Chamie, Andres Salgado, Claudia Sánchez Morales","Carolina Ramírez, Carlos Torres, Andres Sandoval",N/A,N/A,N/A,N/A,N/A,N/A,tt8599488,N/A
Dial M For Jasper,2018,N/A,13 min,"Animation, Adventure, Comedy","Jordan Cwierz, Yssa Badiola","Jordan Cwierz, Gray G. Haddock, Leigh Lahav","Jordan Cwierz, Lee Eddy, Ryan Haywood","David is visited by the vision of an old friend. Max, Neil, and Nikki do some sleuthing to find out why David is so shaken up by the whole thing.",N/A,N/A,N/A,N/A,33,tt8599508,N/A
Out of Time,2020,N/A,73 min,Drama,Leon Lopez,Kerry Williams,"Marcus Collins, Suzanne Collins, Jamie Cousins","When ex -Fighting champion Danny's 8-year sentence is over, he returns home to a revelation. Not only is his beloved gym under pressure, his childhood sweetheart Sam and their only son Connor have been covering a huge secret. Sam is unsure how to reveal and handle the whole situation and both are terrified to tell. Only one thing's for certain. ALL OF THEIR LIVES WILL CHANGE FOREVER.",English,United Kingdom,N/A,5.5,90,tt8599512,N/A
Carillon,2018,N/A,8 min,"Short, Drama, Fantasy",Stefano Bolognini,"Stefano Dallan, Nina J. Kors","Alessandra Quattrini, Marco Tizianel, Giovanni Lopez","Ortensia is a mechanical ballerina that every day is forced to dance for an audience, in a seemingly endless loop. But one day, she sees in the crowd someone drawing her: the first representation of herself as an individual.",Italian,Italy,1 win,7.4,9,tt8599526,N/A
Henry IV,2018,N/A,N/A,Drama,Phyllida Lloyd,N/A,"Jade Anouka, Sheila Atim, Jackie Clune","In Henry IV, Shakespeare's monumental history play travels to the heart of family, duty and country as it asks ""What makes a king? What makes a father?"" Shakespeare's monumental history play travels to the heart of family, duty an...",N/A,N/A,N/A,8.1,11,tt8599544,N/A
The Tempest,2018,N/A,N/A,Drama,Phyllida Lloyd,N/A,"Jade Anouka, Sheila Atim, Jackie Clune","Set on an isle ""full of noises"", this magical production sees Harriet Walter take on the role of Prospero, in Shakespeare's evocation of the eternal struggle for liberation, morality and justice.",N/A,N/A,N/A,8.1,15,tt8599552,N/A
Street Fighter: Enter Vega,2011,N/A,24 min,"Short, Action",Stephen Groo,Stephen Groo,"Todd Andersen, Devon Anderson, Micah Dahl Anderson","General Bison has hired Vega to kidnap Ken Masters for ransom, but the friends to Ken will do what it takes for that not to happen.",English,United States,N/A,N/A,7,tt8599556,N/A
Derren Brown: Miracle,2016,N/A,73 min,Documentary,"Julia Knowles, John L. Spencer","Derren Brown, Andy Nyman, Andrew O'Connor",Derren Brown,"Illusionist Derren Brown reinvents the concept of ""faith healing"" through a series of stunts that debunk the confines of fear, pain and disbelief.",English,United Kingdom,N/A,6.6,"1,176",tt8599562,N/A
The Sanctuary,2019,N/A,100 min,"Drama, Thriller",Allen Kool,Robin E. Crozier,"Rick Amsbury, Eve Kanyo, Ed Robinson","After the brutal murder of his girlfriend, Wade Overton (Dylen Michael Guiry) escapes from custody following a deadly car crash. While on the run evading Sheriff Nate Fields (John-Riley O'Handley), Wade eventually finds refuge with Edna Whalen (Lawrene Denkers) and Harley Whalen (Rick Amsbury). As Wade plot's their demise, and we fear for their future, it becomes clear that appearances are not always what they seem.",N/A,Canada,49 wins & 25 nominations,4.2,79,tt8599572,N/A
Procession,2018,N/A,7 min,Short,Jeda de Brí,Jeda de Brí,"Olwen Fouéré, Sahar Ali, Serena Brabazon",N/A,English,Ireland,1 win,N/A,N/A,tt8599658,N/A
Warren Miller's Line of Descent,2017,TV-14,98 min,"Documentary, Sport",Chris Patterson,N/A,Jonny Moseley,"Travel the globe by land, air and sea, and explore the ties that bind ski culture and create an international family of extreme athletes on the world's mountains.",English,United States,N/A,6.0,21,tt8599716,N/A
Let's Dance,2019,TV-MA,109 min,"Comedy, Drama, Family",Ladislas Chollat,"Ladislas Chollat, Joris Morio, Jane English","Rayane Bensetti, Alexia Giordano, Guillaume de Tonquédec","Joseph, passionate dancer of hip-hop, refuses to enter the company of his father to try his luck in Paris. With his girlfriend Emma and his best friend Karim, he joins the Paris crew of Yuri, a famous breaker, to try to win an international competition of hip-hop.",French,"France, Belgium",N/A,5.9,"1,666",tt8599746,N/A
High Tide,2018,N/A,22 min,"Short, Drama",Claire Zhou,Claire Zhou,"Joshua Albano, Mouad Ben-Chaib, Floor van Vloten",A man takes himself to a woodland cottage to escape the pain and confusion of an impending divorce. Whilst enlisting the owner to fix the broken water he begins to uncover and embrace his hidden desires - a journey of self-discovery and healing.,Dutch,Netherlands,4 wins & 4 nominations,7.0,197,tt8599824,N/A
Bist du glücklich?,2018,N/A,88 min,"Drama, Romance",Max Zähle,David Ungureit,"Ronald Zehrfeld, Laura Tonke, Eleonore Weisgerber",A separated couple drive to their country house to sell it. In the meantime they remember all the good and bad days of their relationship.,German,Germany,1 win & 2 nominations,7.0,108,tt8599904,N/A
Tomb Raider: Holy Statue of Light,2010,N/A,3 min,"Short, Action",Stephen Groo,Stephen Groo,"Trevor Kelley, Steven Walters, Trisha Walters",Another adventure for Lara Croft searching for a lost treasure.,English,United States,N/A,N/A,N/A,tt8599966,N/A
The Campout,2004,N/A,30 min,"Short, Thriller",Stephen Groo,N/A,"Jake Benson, Stephen Groo, Kelli Olsen, Jay Scoby",A group of friends go on a camp out that turns out to be deadly for them all.,English,USA,N/A,N/A,N/A,tt8600070,N/A
Reassortment (OVA),2012,N/A,48 min,"Animation, Action, Romance",N/A,N/A,"Yûki Kaji, Ai Kayano, Kana Hanazawa","A one-hour Noitamina special that recaptures the first 11 episodes of Guilty Crown, and introduces the highlights for the second half.",Japanese,Japan,N/A,N/A,26,tt8600084,N/A
