title,year,rated,runtime,genre,director,writer,actors,plot,language,country,awards,imdb_rating,imdb_votes,imdb_id,metascore
Growing Pains,2021,TV-14,44 min,Reality-TV,N/A,N/A,"Ruby Mahoney, Monica Beets, Rick Ness","When mechanic Carl is forced to leave the claim for an emergency surgery, Rick's team bands together to stay on the gold. Fred's crew step up after their loader dies.",N/A,N/A,N/A,N/A,19,tt14102416,N/A
Komaneko,2009,N/A,60 min,Animation,Tsuneo Goda,N/A,Kyoka Takizawa,"Komaneko the curious cat is a stop motion movie directed by Tsuneo Goda. The story follows Komaneko as he sets about directing his very own stop motion picture featuring his best friends, two little knitted toys.",Japanese,Japan,N/A,7.2,84,tt1410243,N/A
The Maharajah of Bangmor,1972,N/A,54 min,Adult,N/A,N/A,"Wilbur Ahole, Lagusa Bendova, Rick Conlin","The Maharajah is joined by his trusty dwarf guard as they delve into his harem of dancing girls. When intruders stumble upon his desert palace they're punishment is swift, they must join in.",English,United States,N/A,N/A,N/A,tt1410246,N/A
"Moi, Van Gogh",2009,Not Rated,40 min,Short,François Bertrand,"François Bertrand, Peter Knapp, Marie Sellier","Jacques Gamblin, Peter Knapp, Hélène Seuzaret","Dive into the heart of Van Goghs paintings. For the first time, discover in IMAX the fantastic colors and passionate brushwork of a great genius as they take on a new life before our eyes.",French,France,N/A,7.2,194,tt1410248,N/A
On to Washington,1913,N/A,1 min,"Documentary, Short",N/A,N/A,"Elisabeth Freeman, Rosalie Jones","A brief excerpt from the Universal newsreel, Animated Weekly, No. 50 (1913).","None, English",United States,N/A,5.0,51,tt1410251,N/A
One-Zero,2009,N/A,105 min,Drama,Kamlah Abu-Zikri,Mariam Naoum,"Ilham Shaheen, Kal Naga, Nilli Karim","8 characters in one day, one city, one football match, one goal, Egypt wins one-Zero, everyone happy.. is it all real happiness? or is it just a release of repressed exploding emotions of all 8 characters on the verge of a nervous breakdown!.",Arabic,Egypt,5 wins & 3 nominations,6.4,577,tt1410252,N/A
Receive Bacon,2009,Not Rated,3 min,"Short, Comedy",James M. Johnston,James M. Johnston,"Kelli Bland, Jonny Mars",A raunchy bathroom tryst is interrupted by an unfortunate case of the giggles.,English,United States,N/A,N/A,6,tt1410256,N/A
The Swinging Genie,1973,X,57 min,"Adult, Fantasy",Duke Latifundia,Rafael Bordoni,"Keith Erickson, Mary Dunhill, Louise Martin","Most early '70s porn quickies tend to be slapdash, as is this one, but at least there's an attempt to have a script and try to create some amateur special effects for the semblance of a ""real"" movie. Not adding up to much it is an OK showcase for some pretty actresses.Wearing a hairpiece that looks like it was willed to him by Moe Howard (the leader of The Three Stooges), Keith Erickson toplines as Marsh, a ""swinging"" guy who talks in a very '60s hip manner, but comes off as having studied the movies of Bing Crosby to get that cool patter going. If Der Bingle had been allowed to talk on screen about pot and other drugs I'm sure he was exposed to, this dialog could have been delivered in the '30s.He gets to make wishes courtesy of a nondescript genie (non-actor in the role is terrible, reading his dialog from cue cards apparently on the floor, as he keeps looking down to see what to say), and of course he wishes for pretty girls to appear and have sex with him. The idiot writing a pointless blow-by-blow booklet description for the film to be included as an ""extra"" with the DVD claims the genie being male is evidence of homo-erotic subtext; hey, the genie conjures up WOMEN, you don't need a female genie in porn, clown, just because Barbara Eden once played one.Erickson wishes for a magic carpet ride and through the magic of no-budget filmmaking, a jump cut later he is back, dressed in Arab gear, scene carefully omitted.This nonsense is basically Keith talking as a mister motormouth, with XXX footage the key visual. White smoke covers the frame for ""magical"" transitions (it actually works at this level of Z movie), and a cute but ultra-cheap animated credits sequence sets the mood. Orgy involving lovely harem girls helps eat up much of the less-than-an-hour running time.Two competing video companies have reissued the film, using nearly the same materials. The Alpha Blue Archives version is slightly longer, but of inferior visual quality, evidently just a DVD created from a VHS in the usual blur-o-vision. The After Hours Cinema edition has the opening credits messed up but provides a sharper image.Unfortunately, the AHC honchos (quite proud of their preservation efforts, per a short documentary on same they included on one of their videos) have issued the GENIE in letter-box format, losing image at both the top and bottom of the screen. I can't believe so-called professionals don't understand the difference between 1.33/1, 1.66/1, 1.85/1 and 2.35/1, the main ratios used for real films over the years, and think they're doing the viewer a favor by imposing a roughly 1.78/1 or 1.85/1 image to everything. Even 8mm stag loops are issued by AHC in their crude 42nd St. Pete videos, trumpeted as ""first time in widescreen"", as if anybody ever shot ""widescreen"" in Super 8! It's all insulting marketing hype, on the level of spoon-feeding the contents, scene by scene, sex act by sex act, in condescending summaries. Porn fans back in the day were perfectly able to enjoy cinema without explanation or annotation, so I don't see why even a retarded generation of retro-fans needs such asinine instruction. I guess it keeps a few itinerant bloggers in pin money as self-appointed ""historians"" shilling for this or that video outfit.My favorite Annette Michael has little to do but show off her huge breasts and hump Erickson as a harem girl, accompanied by the beautiful Jill Sweete and in a not-well disguised dual role, Sandy Dempsey. Dempsey is cast in a lead role here as Joy, but to save a buck she is also a fantasy harem girl conjured up by the genie wearing a veil. Her butterfly tattoo gives away the game, and later she removes the veil to hump Erickson, and is merely wearing a different hairdo than her short-cropped styling as Joy.",English,United States,N/A,N/A,16,tt1410260,N/A
Rule Number 17,2021,TV-14,42 min,"Action, Crime, Drama",Steve Robin,"Anna Fricke, Albert S. Ruddy, Leslie Greif","Jared Padalecki, Lindsey Morgan, Molly Hagan","Walker and Captain James investigate a high stakes poker game where one of the players may have information on Emily's killer, but things takes a turn when Geri shows up",English,United States,N/A,N/A,1885,tt14102608,N/A
Symbol,2009,Not Rated,93 min,"Comedy, Fantasy, Mystery",Hitoshi Matsumoto,"Hitoshi Matsumoto, Mitsuyoshi Takasu","Hitoshi Matsumoto, David Quintero, Luis Accinelli","A man wakes up alone in a brightly illuminated white room with no windows or doors. When he presses a mysteriously phallic protuberance that appears on one wall, a pink toothbrush materializes from nowhere, clattering to the floor and setting in motion a genuinely bizarre chain of events. Soon the imprisoned man is engaged in absurd and hilarious attempts to escape the gleaming room, releasing random objects from the walls, creating a life sized mouse trap game in which a rope, a toilet plunger and an earthenware jug full of sushi might just be the keys to his escape. Meanwhile, in a dusty town, a green masked Mexican wrestler known as Escargot Man prepares for an important match. His family gathers around him, worried about his seeming impassivity before battle.","Russian, Japanese, Spanish, English",Japan,5 nominations,6.9,"4,624",tt1410261,N/A
Eine für alle - Frauen können's besser,2009,N/A,25 min,"Drama, Romance",N/A,N/A,"Katharina Schubert, Tom Wlaschiha, Jürgen Haug",N/A,German,Germany,N/A,4.6,20,tt1410265,N/A
Studio 2,2004–,N/A,30 min,"Comedy, Family",N/A,N/A,"Geoffrey Bell, Matthew Gibb, Vicki Lin","I watched this briefly when I was a child. There wasn't much to it - mostly some interviews and skits. For what it was, it was engaging and funny.",English,New Zealand,N/A,6.7,9,tt1410266,N/A
From the Ashes,2021,TV-G,42 min,"Drama, History, Romance",Peter DeLuise,"Janette Oke, Derek Thompson, Brian Bird","Erin Krakow, Pascale Hutton, Jack Wagner",A geyser erupts at the oil rig and everyone in Hope Valley drops everything to help. Nathan is summoned for an inquiry by a Mountie from his past and Jesse takes a liking to driving Lee's motorcycle.,N/A,N/A,N/A,7.0,508,tt14102668,N/A
El asesino a sueldo,2009,N/A,N/A,Drama,Salomón Shang,"Dolores Falkner, Helena Mas, Tomás Pérez","Nausicaa Bonnín, Babou Cham, Scott Cleverdon",N/A,Spanish,Spain,N/A,5.8,10,tt1410267,N/A
Welcome to Hope Valley,2021,TV-G,N/A,"Drama, History, Romance",Peter DeLuise,"Janette Oke, Brian Bird, Michael Landon Jr.","Erin Krakow, Pascale Hutton, Jack Wagner","The inquiry begins, and Nathan starts to question his own actions. Meanwhile, a new family, the Canfields, buy Gowen's cabin and Elizabeth welcomes them to Hope Valley. Lee's sister and niece arrive in Hope Valley.",N/A,N/A,N/A,7.0,507,tt14102672,N/A
What the Heart Wants,2021,TV-G,N/A,"Drama, History, Romance",Mike Rohl,"Janette Oke, Elizabeth Stewart, Brian Bird","Erin Krakow, Pascale Hutton, Jack Wagner",It's graduation day at the Jack Thornton School house. Rosemary and Lee adjust to having family in town. A letter from Dottie sends all the Coulters reeling. Clara learns Jesse made a big mistake.,N/A,N/A,N/A,6.9,523,tt14102676,N/A
Dr. Jekyll and Mr. Hyde,1988,N/A,N/A,"Action, Romance",N/A,N/A,N/A,"A mild-mannered doctor (Jekyll) with a monstrous alter-ego (Hyde) must navigate through the streets of London where they are constantly accosted by well-dressed thugs, defecating crows, randomly placed bombs, and other assorted hazards. The player primarily controls Dr. Jekyll, but if the doctor suffers too much damage he transforms into his villainous counterpart and is sent to a Hellish, monster-infested alternate reality. The ultimate goal is to reach the church where his lover, Miss Millicent, is waiting to marry him.","Japanese, English",Japan,N/A,2.5,29,tt1410268,N/A
No Regrets,2021,TV-G,N/A,"Drama, History, Romance",Mike Rohl,"Janette Oke, Derek Thompson, Brian Bird","Erin Krakow, Kavan Smith, Jack Wagner",Elizabeth wonders if she is truly ready to let love in again. Rosemary wonders what her purpose is. Clara and Jesse sort through their issues. Carson receives an amazing opportunity. A stranger named Christopher comes in town.,N/A,N/A,N/A,7.0,533,tt14102682,N/A
Les Hardings,2021,N/A,77 min,Drama,Francois Blouin,Alexia Bürger (play),"Martin Drainville, Patrice Dubois, Bruno Marcil",N/A,"English, French",Canada,N/A,N/A,N/A,tt14102698,N/A
Cinderella Moon,2010,N/A,96 min,Drama,Richard Bowen,Richard Bowen,"Xiao Min, Zhang Jie, Caiping Wang","An enthralling and magical version of Cinderella found among the treasure trove of ancient Chinese stories. With more depth and delight than the vanilla Disney version, a young woman is charged not just with finding a prince, but restoring the balance of nature and the earth.Not merely an amazing story, Cinderella Moon is infused with fantastic settings, actors, sets, cinematography, direction and other nuances. Seen at the Toronto International Film Festival.","English, Mandarin",China,N/A,6.3,35,tt1410270,N/A
10.10.20,2021,N/A,N/A,Reality-TV,N/A,N/A,"Kenya Moore, Kandi Burruss, Drew Sidora","Cynthia and Mike's big day has arrived. Meanwhile, more press leaks about the weekend in South Carolina have spread, leading the women to speculate who the source might be. Shamea attempts to shelter the nieces from the judgmental...",N/A,N/A,N/A,N/A,14,tt14102700,N/A
A Simmons by Any Other Name,2021,N/A,N/A,Reality-TV,N/A,N/A,"Tiffany Moon, Kameron Westcott, Jill Berger","D'Andra's Medicine Monday leaves Brandi feeling like she betrayed her religious beliefs. Tiffany has a big meeting with her boss to reduce her work hours, while Kameron lays down the law with Court about their house hunting. At Tiffany's birthday party, Brandi challenges D'Andra's commitment to Christianity and Mama Dee reveals the reason why D'Andra changed her last name to Simmons.",N/A,N/A,N/A,N/A,7,tt14102702,N/A
Marching Band,2009,N/A,95 min,Documentary,"Claude Miller, Héléna Cotinier, Pierre-Nicolas Durand",N/A,Barack Obama,A documentary on American marching bands with a background of the 2008 presidential election.,French,France,N/A,6.1,36,tt1410271,N/A
Kiss My Peach,2021,N/A,N/A,Reality-TV,N/A,N/A,"Jennifer Aydin, Jackie Goldschneider, Margaret Josephs","Dolores and David address their relationship while Jennifer's relationship with her mother worsens. Melissa and Joe confront Michelle and Jon about the rumor they are spreading, and Teresa throws a wild pool party that ends badly.",N/A,N/A,N/A,N/A,13,tt14102712,N/A
Before Your Eyes,2009,Not Rated,102 min,Drama,Miraz Bezar,"Miraz Bezar, Evrim Alatas, Ricky Watson","Senay Orak, Muhammed Al, Hakan Karsak","Ten-year old Gulistan and her younger brother Firat live happily with their parents in Diyarbakir, the heart of Turkish Kurdistan. Tragedy strikes when their mother and father are shot down by paramilitary gunmen before their eyes. Traumatised and orphaned, Gulistan, Firat and their infant sister are placed in the care of their young, politically-active aunt Yekbun who soon disappears without a trace. As days turn into weeks, the money that their aunt left them runs out. Eventually, the children have to fend for themselves on the streets, where one day, Gulistan is shocked to come across the murderer of her parents.","Kurdish, Turkish","Germany, Turkey",13 wins & 6 nominations total,7.3,"1,359",tt1410272,N/A
Claw 2: Blood Legacy,2021,N/A,91 min,Horror,"Michelle Carmen Gomez, David Palmieri","Michelle Carmen Gomez, David Palmieri","David Palmieri, Michelle Carmen Gomez, Justin Pavia",A writer begins to encounter a series of unexplainable events when he's forced to lift the lid on the Pandora's Box holding the demons of his past.,English,United States,N/A,N/A,13,tt14102720,N/A
In Too Deep,2021,TV-14,48 min,Reality-TV,N/A,N/A,"Dustin Hurt, Fred Hurt, Ryan Cardoza","Dustin risks the remainder of his season on an ambitious move upstream to raging waters, in a quest to add to his record breaking gold haul. After a brush with death, Fred must come up with a new plan before someone gets killed in...",N/A,N/A,N/A,N/A,11,tt14102730,N/A
Un'estate ai Caraibi,2009,N/A,110 min,Comedy,Carlo Vanzina,"Carlo Vanzina, Enrico Vanzina","Enrico Brignano, Carlo Buccirosso, Biagio Izzo","As fun-seeking tourists converge on the beautiful Caribbean island of Antigua, several interconnected stories merge into one.",Italian,Italy,N/A,4.5,435,tt1410276,N/A
The Lift,2008,N/A,25 min,"Short, Horror",Kenny Evans,Kenny Evans,"Luke Jasztal, Peter Blake, Emma Burford","When Daniel is sent on a a regular errand for his boss he has no idea it will plunge him into the most frightening experience of his life, setting him on a kharmic rollercoaster and forcing him to face an event in his past he thought he had buried.",English,United Kingdom,N/A,5.6,6,tt1410278,N/A
A New Beginning,2021,N/A,N/A,Reality-TV,Jeff Uncapher,Paulina Robak,"Ben Napier, Erin Napier",A photographer and close friend of the Napier's is looking for a traditional home with a touch of modern style. Ben and Erin transform a classic mansion in need of a complete makeover into a show-stopping home.,N/A,N/A,N/A,N/A,8,tt14102782,N/A
Saudade: The Lisbon I Never Knew,2021,N/A,6 min,"Short, History",Márcio D'Astrain,Márcio D'Astrain,Tom Mustin,A love letter from an American soul to the city of Lisbon.,English,Portugal,N/A,N/A,N/A,tt14102784,N/A
Color Psychology,2021,TV-G,43 min,Reality-TV,Jeff Uncapher,Paulina Robak,"Ben Napier, Erin Napier",A couple who runs a non-profit is investing in a property that provides transitional housing for women recovering from difficulties. Ben and Erin get scrappy and turn a neglected building into an uplifting oasis where new beginnin...,N/A,N/A,N/A,N/A,9,tt14102786,N/A
A Musician's Retreat,2021,TV-G,43 min,Reality-TV,Jeff Uncapher,Paulina Robak,"Ben Napier, Erin Napier","A recording producer is back in Laurel looking for an artist's retreat. He received a dilapidated cabin from his late father, and while Ben and Erin are up for the risky restoration challenge, they think he'll get a better return ...",N/A,N/A,N/A,N/A,9,tt14102792,N/A
Big Apple to Little Catfish,2021,TV-G,43 min,Reality-TV,Jeff Uncapher,Paulina Robak,"Ben Napier, Erin Napier","A surgeon and his wife are moving to Laurel from New York City, and their all-in budget goes a long way in the Mississippi town. Ben and Erin pay homage to the historic property's original elements and peculiar charm to design an ...",N/A,N/A,N/A,N/A,8,tt14102808,N/A
Królik po berlinsku,2009,Not Rated,51 min,"Documentary, History, News",Bartosz Konopka,"Bartosz Konopka, Mateusz Romaszkan, Piotr Rosolowski",N/A,"The untold story about wild rabbits which lived between the Berlin Walls. For 28 years Death Zone was their safest home. Full of grass, no predators, guards protecting them from human disturbance. They were closed but happy. When their population grew up to thousands, guards started to remove them. But rabbits survived and stayed there. Unfortunately one day the wall fell down. Rabbits had to abandon comfortable system. They moved to West Berlin and have been living there in a few colonies since then. They are still learning how to live in the free world, same as we - the citizens of Eastern Europe.","German, Polish","Poland, Germany",Nominated for 1 Oscar. 6 wins & 3 nominations total,7.5,934,tt1410281,N/A
A Laurel Hug,2021,N/A,N/A,Reality-TV,Jeff Uncapher,Paulina Robak,"Ben Napier, Erin Napier","A woman is moving back to Laurel to be close to family after the sudden passing of her husband. Ben and Erin thoughtfully bring their design to life and create a gorgeous, sun-filled home to help get her through this difficult time.",N/A,N/A,N/A,N/A,7,tt14102812,N/A
All in the Family,2021,N/A,N/A,Reality-TV,Jeff Uncapher,Paulina Robak,"Ben Napier, Erin Napier","Erin's uncle likes to go big when it comes to restoring old houses, and he's not concerned about the budget. Together with his son, Jim, Ben and Erin try to convince him that bigger isn't always better in a historical home renovat...",N/A,N/A,N/A,N/A,8,tt14102816,N/A
Sinterklaas en de verdwenen pakjesboot,2009,N/A,96 min,Family,Martijn van Nellestijn,Martijn van Nellestijn,"Wim Rijken, Harold Verwoert, Alex van Bergen","An exciting family film that starts at Saint Nicolas' castle in Spain. When he and Diego arrive at the harbor the boat with all the children's presents has disappeared. A race against time ensues to get the boat with its cargo of goodies back. An exhilarating adventure which starts in Spain, takes us across Belgium and the Netherlands, and finally to December 5th.",Dutch,Netherlands,1 win,5.8,80,tt1410282,N/A
Closer to Mom,2021,N/A,N/A,Reality-TV,Jeff Uncapher,Paulina Robak,"Ben Napier, Erin Napier","A New Orleans couple looks for a vacation home to be closer to her mom, and the ideal house needs space for hosting crawfish boils; Ben and Erin transform a dated home into a modern oasis, complete with two kitchens and a pool.",N/A,N/A,N/A,N/A,7,tt14102824,N/A
State of Romance,2009–,N/A,N/A,"Comedy, Romance",N/A,N/A,"Amy Anderson, Josh Ardolf, Mike Bach, Steve Beatty","A modern day ""Pride & Prejudice"" set in Chicago.",English,USA,N/A,7.3,12,tt1410283,N/A
Parece Impossível,2009,N/A,50 min,"Comedy, Drama, Family",Sérgio Graciano,"Helena Amaral, Isabel Frausto, Fernando Heitor","Miguel Guilherme, Rita Blanco, Luís Ganito, Catarina Avelar",N/A,N/A,N/A,N/A,N/A,N/A,tt1410284,N/A
La dame de trèfle,2009,N/A,99 min,"Crime, Drama",Jérôme Bonnell,Jérôme Bonnell,"Malik Zidi, Florence Loiret Caille, Marc Barbé","Aurélien and Argine have never been able to leave each other. Brother and sister, they have always lived together. Aurélien secretly makes ends meet for them by dealing in stolen metal. One night, his accomplice Simon suddenly arrives.",French,France,1 nomination,6.1,194,tt1410294,N/A
Beauty and the Beast,2010,R,90 min,"Drama, Fantasy, Horror",David Lister,Gavin Scott,"Estella Warren, Rhett Giles, Victor Parascos","A dark twist on the morality tale of forbidden love between beautiful Belle and the feared forest Beast. As villagers are being brutally murdered and the Beast is hunted down as the one responsible for the mayhem, Belle and Beast team up to defeat the real killer the power-hungry witch's malevolent troll.",English,"Canada, Australia",N/A,3.1,"1,861",tt1410295,N/A
Belleville story,2010,N/A,85 min,Crime,Arnaud Malherbe,Arnaud Malherbe,"Pascal Aubert, Ottis Ba, Nicolas Baloche","A mysterious man arrives from China in search of a missing young woman, facing the underworld of Parisian crime.",French,France,N/A,6.3,67,tt1410296,N/A
The Well Beloved One,2010,N/A,107 min,Comedy,Guel Arraes,"Guel Arraes, Cláudio Paiva","Marco Nanini, José Wilker, Matheus Nachtergaele","Elected major of the small city of Sucupira, after unfortunate situation, Odorico (Marco Nanini) must open the city cemitery and face acusations of being corrupt, to end his term on good terms with the people",Portuguese,Brazil,6 wins & 24 nominations,6.4,606,tt1410297,N/A
Braindamadj'd... Take II,2006,N/A,50 min,Documentary,Paul Nadler,"Jonathan Finkelstein, Paul Nadler",N/A,"Ten years ago, Montrealer Paul Nadler at 30 was a creative maverick - snowboarding, rock-climbing and scuba diving, taking part in all-night play-writing sessions, attracting women, and winning awards as a hip television director. Then he was found alone on a road in Egypt, without clothes and I.D., comatose in the hot sun after a car accident. He had been left for dead. The doctors said he would never recover from TBI - Traumatic Brain Injury. Braindamadj'd...Take II traces the excruciating process of recovery, both physical and psychological. It features Nadler's often sardonic comments on his progress, and the observations of key people involved in his recovery. Among them are his doggedly supportive mother, Vera Nadler-Hébert, his ironic but firm-willed father Arie; his sister, cousins, friends, colleagues and medical professionals - neurologists and therapists, one of whom asserts that working with Paul has changed the way she treats patients. As the film shows, Nadler sets goals that seem physically and psychologically impossible. Never shying away from attention, Nadler returns to school for his master's degree in communications, and his career takes a surprise twist.","French, English",Canada,2 wins.,7.4,8,tt1410298,N/A
And The Winner Is...,2021,N/A,N/A,Reality-TV,N/A,N/A,"Rubina Dilaik, Rahul Vaidya, Nikki Tamboli","140 days, 5 finalists, amazing performances and an epic finale. Check out who wins the trophy and who bags the cash prize in the grand finale of Bigg Boss S14 with Salman Khan.",N/A,N/A,N/A,N/A,9,tt14102996,N/A
Jerry Herman: Broadway at the Bowl,1994,N/A,132 min,"Documentary, Biography, Drama",N/A,N/A,"Bill Collins, Jerry Herman",N/A,English,Australia,N/A,7.8,12,tt1410301,N/A
Little Blue Planet,2005,N/A,4 min,"Animation, Short, Music",Markus Kellow,Markus Kellow,Cynthia Mothelesi,Little Blue Planet is a meditation for the human world; a temporal odyssey on a busy Earth. Both beauty and chaos are placed into contrast. Frenzy and peace exist together. The human world ...,English,Australia,N/A,7.6,11,tt1410302,N/A
Slippery Slope,2021,N/A,22 min,Comedy,Justin Wu,"Ins Choi, Kevin White, Anita Kapila","Paul Sun-Hyung Lee, Jean Yoon, Andrea Bang",Appa worries about Umma after a minor household accident. Janet uses Jung's past to boost her reputation with students. A high school reunion has Kimchee thinking about an old flame.,English,Canada,N/A,7.6,240,tt14103024,N/A
Pleasure Yourself,2021,TV-MA,22 min,"Comedy, Drama",Aleysa Young,"Daniel Gold, Karen Kicak","Catherine Reitman, Dani Kind, Jessalyn Wanlim",Kate walks further into the lioness' den with Sloane. Anne starts her new job. Alice gets closer with her new boyfriend. Jenny discovers her secret office romance with MCP might not be exactly what she expected.,N/A,N/A,N/A,N/A,106,tt14103066,N/A
Majnu,2021,N/A,48 min,N/A,Vicky Zahed,Vicky Zahed,"Shahed Ali, Khairul Basar, Mehzabien Chowdhury, Afran Nisho",N/A,Bengali,Bangladesh,N/A,N/A,N/A,tt14103076,N/A
The Making of WandaVision,2021,TV-14,58 min,Documentary,Brad Baruh,Meghan Leon,"Elizabeth Olsen, Paul Bettany, Jac Schaeffer","Join Elizabeth Olsen, Paul Bettany and more, to go behind the scenes of the groundbreaking series 'WandaVision'.",English,United States,N/A,8.3,1023,tt14103088,N/A
Lolito,2009,N/A,N/A,Comedy,Jesús Colmenar,"Daniel Écija, Álex Pina","Paco Tous, Pepón Nieto, Michelle Jenner, Carlos Santos",N/A,N/A,N/A,N/A,N/A,N/A,tt1410311,N/A
Caitlyn Jenner: Why I Failed to Make an Impact in Trans Community,2020,N/A,N/A,N/A,N/A,N/A,"Caitlyn Jenner, Carlos Watson",N/A,N/A,N/A,N/A,N/A,130,tt14103118,N/A
Avel and Kain,2000,N/A,N/A,Thriller,Andrey Malyukov,N/A,"Valentin Bukin, Ilse Liepa, Igor Livanov",N/A,N/A,N/A,N/A,N/A,N/A,tt1410313,N/A
Brandon's Cult Movie Reviews,2011–,N/A,N/A,Comedy,N/A,Brandon Tenold,"Brandon Tenold, Chris Cuypers, Petar Gagic",A Canadian Film Critic takes a look at B movies from the 50s - 90s while occasionally getting threatened by a Man with scissors.,English,United States,N/A,N/A,45,tt14103138,N/A
Breaking New Ground,2021,N/A,N/A,Reality-TV,N/A,N/A,"Chip Gaines, Joanna Gaines","Chip and Joanna expand the footprint of the Silos grounds in Waco, Texas.",English,N/A,N/A,N/A,10,tt14103154,N/A
